{
  "$schema": "../../../schemas/exam.schema.json",
  "id": "midterm-systems-sql",
  "title": "Evaluación Intermedia: Fundamentos, Formatos y Modelado DWH",
  "subtitle": "Examen de control para los Bloques 1, 2 y 3 (Fundamentos, Formatos Columnares y Modelado Dimensional)",
  "badge": "MID",
  "durationMinutes": 60,
  "langs": [
    "es"
  ],
  "selection": {
    "mode": "pool",
    "domainIds": [
      "fundamentos-ciclo-vida-datos",
      "ingestion-formatos-motores-locales",
      "modelado-dimensional-sql-dwh"
    ],
    "count": 12
  }
}