{
  "$schema": "../../../schemas/exam.schema.json",
  "id": "final-distributed-streaming",
  "title": "Examen Final: Lakehouse, DataOps y Streaming en Tiempo Real",
  "subtitle": "Examen de certificación para los Bloques 4, 5 y 6 (Delta Lake, Airflow y Apache Kafka)",
  "badge": "FIN",
  "durationMinutes": 90,
  "langs": [
    "es"
  ],
  "selection": {
    "mode": "pool",
    "domainIds": [
      "lakehouse-acid-tables",
      "orchestration-quality-dataops",
      "streaming-realtime-cdc"
    ],
    "count": 12
  }
}