{
  "$schema": "../../../schemas/exam.schema.json",
  "id": "midterm-systems-sql",
  "title": "Evaluación Intermedia: Sistemas, Python y Modelado SQL",
  "subtitle": "Examen de control para los Bloques 1, 2 y 3 (Fundamentos, Python robusto y Bases de Datos)",
  "badge": "MID",
  "durationMinutes": 90,
  "langs": ["es"],
  "selection": {
    "mode": "pool",
    "domainIds": [
      "cs-fundamentals-os",
      "robust-programming-ingestion",
      "relational-modeling-olap"
    ],
    "count": 25
  }
}
